,Domain,Wikipedia Link,Title,Context,Type,Question,Answer
2820,Medications,https://hi.wikipedia.org/wiki/%E0%A4%B9%E0%A5%87%E0%A4%AA%E0%A5%87%E0%A4%9F%E0%A4%BE%E0%A4%87%E0%A4%9F%E0%A4%BF%E0%A4%B8_%E0%A4%8F_%E0%A4%95%E0%A4%BE_%E0%A4%9F%E0%A5%80%E0%A4%95%E0%A4%BE,हेपेटाइटिस ए का टीका,"हेपेटाइटिस ए का टीका एक टीका है जो हेपेटाइटिस ए से बचाता है।[1] यह लगभग 95% मामलों में प्रभावि है और पंद्रह वर्षों तक और संभवतः एक आदमी के पूरे जिवन में प्रभावि रहता है।[1][2] यदि दिया जाता है, तो एक वर्ष की आयु के आरंभ के बाद दो खुराक की अनुशंसा की जाती है।[1] यह इंजेक्शन द्वारा मांसपेशी में दिया जाता है।[1]
विश्व स्वास्थ्य संगठन (डब्ल्यूएचओ) उन क्षेत्रों में सर्वव्यापक टीकाकरण की सिफारिश करता है जहां बीमारियां सामान्य रूप से होती हैं।[1] जहां यह रोग बहुत आम है, वहाँ टीकाकरण की सिफारिश नहीं की जाती है क्योंकि आमतौर पर सभी लोगों में बचपन में ही संक्रमण के माध्यम से प्रतिरक्षा विकसित हो जाती है।[1] रोग नियंत्रण और रोकथाम केंद्र (सीडीसी) उच्च जोखिम वाले वयस्कों और सभी बच्चों के टीकाकरण की सिफारिश करता है।[3]
गंभीर दुष्परिणाम बहुत दुर्लभ हैं।[1] लगभग 15% बच्चों और आधे वयस्कों में इंजेक्शन की जगह पर दर्द होता है।[1] अधिकांश हेपेटाइटिस ए के टीकों में निष्क्रिय वायरस होता है जबकि कुछ में कमजोर वायरस होता है।[1] कमजोर वायरस वाले लोगों को गर्भावस्था के दौरान या खराब प्रतिरक्षा फंक्शन वाले लोगों के लिए अनुशंसित नहीं किया जाता है।[1] कुछ सूत्र हेपेटाइटिस बी या टाइफाइड के टीके के साथ हेपेटाइटिस ए को जोड़ते हैं।[1]
प्रथम हेपेटाइटिस ए के टीके को 1991 में यूरोप और 1995 में संयुक्त राज्य अमेरिका में अनुमोदित किया गया था।[4] यह विश्व स्वास्थ्य संगठन की आवश्यक दवाओं की सूची में है, जो एक बुनियादी स्वास्थ्य प्रणाली में आवश्यक सबसे महत्वपूर्ण दवा है।[5] संयुक्त राज्य अमेरिका में इसकी लागत 50 से 100 USD के बीच है।[6]",,,
2821,Medications,https://hi.wikipedia.org/wiki/%E0%A4%AE%E0%A5%89%E0%A4%B0%E0%A4%AB%E0%A5%80%E0%A4%A8,मॉरफीन,"मार्फ़िया (मॉरफीन, morphine) एक ऐल्केलॉइड है। सरटर्नर (Sertiirner) द्वारा सन्‌ 1806 में इस ऐल्केलाइड का पृथक्करण अफीम से हुआ था। इसका प्रयोग हाइड्रोक्लोराइड, सल्फेट, एसीटेट, टार्ट्रेट और अन्य संजातों के रूप में होता है। मॉरफीन से पीड़ा दूर होती और गाढ़ी नींद आती है। इसका सेवन मुख से भी कराया जाता है, पर इंजेक्शन से प्रभाव शीघ्रता से होता है।  It have phenanthrene carbon skeleton पीड़ा हरने में यह अद्वितीय पदार्थ सिद्ध हुआ है, पर इसके लगातार सेवन से आदत पड़ जाने की अशंका रहती है। इससे डाक्टर लोग इसका सेवन जहाँ अन्य औषधियों से काम चालाया जा सकता हो, वहाँ नहीं कराते। बहुधा इसका उपयोग दमा खाँसी, विशेषत: कुक्कुर खाँसी, में होता है। कुछ परिस्थितियों में इससे वमन और अतिसार रुकता है। आभ्यंतर रक्तस्त्राव, अभिघातज पीड़ा, गर्भपात की आशंका आदि में इसका व्यवहार होता है। यह बहुमूल्य औषधि है।
एल्कोहॉल में विलयन से वर्णरहित क्रिस्टल के रूप में मॉरफीन प्राप्त होता है। इसे अणु में क्रिस्टलन जल का एक अणु रहता है। अजल मॉरफीन 254° सेंo पर पिघलता है। इसका विशिष्ट घूर्णन [a]d25 = - 132° है। एक ग्राम मॉरफीन 5000 घन सेंमी0 जल में, अथवा 210 घन सेंमी0 एल्कोहॉल में घुलता है। क्षार में यह विलेय है। अम्लों से यह लवण बनाता है। सल्फेट, हाइड्रो-क्लोराइड और एसीटेट इसके महत्व के लवण हैं। इसके लवण लोहे, ताँबे और पारद के लवणों, क्षारमृत्तिका के लवणों तथा टैनिन वाले पदार्थों से मेल नहीं खाते। फेरिक क्लोराइड से यह गाढ़ा नीला रंग देता है। इसका संश्लेषण 27 क्रमों में हुआ है। यह संश्लेषण केवल वैज्ञानिक महत्व का है, व्यापारिक महत्व का नहीं। आज अनेक संश्लिष्ट पदार्थ बने हैं, जो मॉरफीन के स्थान में पीड़ापहारी के रूप में प्रयुक्त हो सकते हैं, या होते हैं। मॉरफीन का अणुसूत्र, (C17 H19 N O3) है,।",,,
2822,Attacks,https://hi.wikipedia.org/wiki/%E0%A4%95%E0%A4%BE%E0%A4%AC%E0%A5%81%E0%A4%B2_%E0%A4%AC%E0%A4%AE_%E0%A4%A7%E0%A4%AE%E0%A4%BE%E0%A4%95%E0%A4%BE_2021,काबुल बम धमाका 2021,"अफगानिस्तान की राजधानी काबुल के पश्चिमी हिस्से में 8 मई 2021 को एक स्कूल के नजदीक बम विस्फोट हुआ। इस धमाके में लगभग 85 लोगों की मृत्यु हो गई और 150 से अधिक लोग घायल हो गए।[1][2] यह विस्फोट अफगानिस्तान के सईद अल-शुहादा स्कूल के निकट हुआ। यह विस्फोट एक गाड़ी के भीतर हुई। विस्फोट के बाद तत्काल ही दो और विस्फोट हुए। हताहतों में अधिकांश 11 और 15 वर्ष की उम्र की लड़कियां थीं। माना जा रहा है कि विस्फोट के इस क्षेत्र में अक्सर इराक़ के क्षेत्रीय उग्रवादियों का हमला होता आया है।[3]
विस्फोट के बाद क्षेत्रीय जनों ने सरकार की लापरवाही के विरुद्ध ज़ोर-शोर से नारें लगाएँ। उनका मानना है कि ये जानते हुए कि यह क्षेत्र आतंकवादियों से पीड़ित रहता है, सरकार ने कोई विशेष सुरक्षा का प्रबंध नहीं किया। लोगों ने दुर्घटना का जिम्मेदार राष्ट्रपति अशरफ़ ग़नी अहमदज़ई को ठहराया और उनके विरुद्ध नारें लगाएँ।[4]
काबुल के सईद अल-शुहदा स्कूल के प्रवेश द्वार के सामने यह दुर्घटना एक वाहन के भीतर रखें बम के विस्फोट के रूप में हुआ। इस दुर्घटना में घायल होने वालो में छात्राओं की संख्या अधिक है।[5]
एक स्कूल शिक्षक ने दुर्घटना का इस प्रकार वर्णन किया कि, ""विस्फोट सबसे पहले एक वाहन में हुआ और फिर बालिका विद्यालयों के पास दो और विस्फोट हुए। आंतरिक मंत्रालय के प्रवक्ता ने भी अपने बयान में कहा है कि प्रारंभिक विस्फोट एक कार बम था[6]
घायल छात्रों में से एक ने कहा है कि विस्फोट होने पर वह स्कूल छोड़ रही थी और लगभग दस मिनट बाद दो और विस्फोट हुआ। उसने आगे बताया कि सभी लोग खून से सने थें। मलबे और निजी सामान मैदान के आसपास बिखरे हुए थे।[7]
बमबारी के दिन 58 लोगों के मारे जाने और 160 से अधिक लोगों के घायल होने की रिपोर्ट दर्ज़ की गई थी। हमले के एक दिन बाद, मरने वालों की संख्या बढ़कर 85 हो गई। पीड़ितों में से अधिकांश 18 वर्ष से कम उम्र की स्कूली छात्राएं थीं। अस्पताल में अधिकांशतः पीड़ितों की उम्र 12-20 वर्ष की दर्ज़ की गई।[8][9]
अफगानिस्तान के राष्ट्रपति अशरफ़ ग़नी अहमदज़ई ने आतंकवादी हमले की निंदा की और घटना के मद्देनजर 11 मई को राष्ट्रीय शोक दिवस के रूप में मनाने की घोषणा की।[10] राष्ट्रपति अशरफ़ ग़नी अहमदज़ई ने हमले के लिए तालिबान को दोषी ठहराया, लेकिन तालिबान के प्रवक्ता ज़बीउल्लाह मुजाहिद ने मीडिया को जारी एक संदेश में हमले में शामिल होने से इनकार किया। तालिबान के प्रवक्ता ने भी हमले की निंदा की और आईएसआईएस को हमले के लिए जिम्मेदार ठहराया। इसके अतिरिक्त उन्होंने अफगानिस्तान के खुफिया विभाग पर आई.एस के साथ मिलीभगत का आरोप लगाया।[11]
घटना के बाद कई पीड़ितों के परिवार वावे भड़क उठें। उन्होंने बमबारी का जिम्मेदार सरकार की लापरवाही को ठहराया। कई लोगों ने तो घटना स्थल पर मौजूद पुलिस कर्मचारियों से हाथापाई भी की। लोगों ने सरकार के विरुद्ध जोरो से नारे लगाएँ।[12]",,,
2823,Attacks,https://hi.wikipedia.org/wiki/%E0%A4%9C%E0%A5%81%E0%A4%B2%E0%A4%BE%E0%A4%88_2009_%E0%A4%95%E0%A5%87_%E0%A4%B8%E0%A4%BE%E0%A4%87%E0%A4%AC%E0%A4%B0_%E0%A4%86%E0%A4%95%E0%A5%8D%E0%A4%B0%E0%A4%AE%E0%A4%A3,जुलाई 2009 के साइबर आक्रमण,"जुलाई 2009 के साइबर आक्रमण दक्षिण कोरिया व संयुक्त राज्य अमेरिका के प्रमुख सरकारी, समाचार माध्यम तथा वित्तीय संजालस्थलों के विरुद्ध समायोजित साइबर हमलों की श्रेणी है।[1] इसके अंतर्गत बड़ी संख्या में अपहृत कंप्यूटरों को (जिन्हें ज़ॉम्बी कंप्यूटर भी कहते हैं) या बॉटनेट को कुछ विशेष संजालस्थलों की ओर निर्दिष्ट कर दिया गया, जिससे वे अतिभारित (ओवरलोड) हो गये[1] आक्रमणों का समय व लक्ष्य यह सुझाते हैं कि इनका उद्गम उत्तर कोरिया हो सकता है, यद्यपि ये संदेह अप्रामाणिक हैं।[2][3][4]
आक्रमणों की पहली लहर 4 जुलाई 2009 को (अमेरिका का स्वतंत्रता दिवस) चली, जिसमें संयुक्त राज्य व दक्षिण कोरिया दोनों को लक्ष्य किया गया। प्रभावित संजालस्थलों में व्हाइट हाउस व पेंटागन की वेबसाइटें भी थीं।[1][5] एक जाँच से पता चला है कि 27 वेबसाइटें कंप्यूटरों पर रक्षित संचिकाओं के लिए आक्रान्त की गईं थीं।[6]
आक्रमणों की दूसरी लहर 7 जुलाई 2009 को हुई, जिसने दक्षिण कोरिया को प्रभावित किया। लक्ष्यभूत संजालस्थल थे- राष्ट्रपति का ब्लू हाउस, द. कोरिया का रक्षा मंत्रालय और राष्ट्रीय सभा[2][7]
आक्रमणों की तीसरी लहर 9 जुलाई को शुरू हुई, जिसमें द. कोरिया के कई संजालस्थल निशाना बने, जिनमें देश की राष्ट्रीय आसूचना सेवा, तथा इसके बृहत्तम बैंकों में से एक व एक बड़ी समाचार एजेंसी थे।[1][8]
ये हमले बड़े सार्वजनिक व निजी क्षेत्र के संजालस्थलों पर किए गये हैं, तथापि दक्षिण कोरिया के राष्ट्रपति कार्यालय का कहना है कि ये अव्यवस्था फैलाने के उद्देश्य से किए गये हैं, न कि आँकड़ों की हैकिंग के लिए।[9] आकलन के अनुसार इस आक्रमण से 23 मैगाबिट प्रति सेकंड आँकड़े उत्पादित हुए।[6] आशंका है कि अधःशायी (डाउन) हुई वेबसाइटों को हुई आर्थिक हानि बड़ी राशि में होगी।[10]
अभी (10-जुलाई-09) यह नहीं पता चला है कि इन हमलों के पीछे कौन रहा है, यद्यपि कुछ दक्षिण कोरियाई अधिकारियों व कई मीडिया संगठनों ने सुझाया है कि उत्तर कोरिया इनके पीछे हो सकता है। रिपोर्टें बताती हैं कि आक्रमण का प्रकार, सेवा-नकार आक्रमण (डिनायल ऑफ़ सर्विस अटैक), अधिक जटिल नहीं था।[4][6][11] परंतु दीर्घवधि होने से इन्हें समन्वित व संगठित आक्रमण माना जा रहा है।[3] दक्षिण कोरियाई राष्ट्रीय आसूचना एजेंसी के अनुसार आक्रमणकारियों ने 16 देशों में स्थित 86 आई पी पतों का प्रयोग किया, जिनमें शामिल देश थे, संयुक्त राज्य, ग्वाटेमाला, जापान तथा पीपुल्स रिपब्लिक ऑफ़ चाइना (चीन), परंतु उत्तर कोरिया इनमें नहीं था।[12][13]
यह भी अनुमान लगाया गया है कि पाँच साल पुराना मायडूम Mydoom कृमि (वॉर्म), किसी अजटिल हैकर के निर्देशन में, इन आक्रमणों के लिए जिम्मेदार था, न कि उत्तर कोरिया।[14]",,,
2824,Attacks,https://hi.wikipedia.org/wiki/%E0%A4%B5%E0%A4%BF%E0%A4%B6%E0%A5%8D%E0%A4%B5_%E0%A4%B5%E0%A5%8D%E0%A4%AF%E0%A4%BE%E0%A4%AA%E0%A4%BE%E0%A4%B0_%E0%A4%95%E0%A5%87%E0%A4%A8%E0%A5%8D%E0%A4%A6%E0%A5%8D%E0%A4%B0_%E0%A4%AC%E0%A4%AE%E0%A4%AC%E0%A4%BE%E0%A4%B0%E0%A5%80_(1993),विश्व व्यापार केन्द्र बमबारी (1993),"विश्व व्यापार केन्द्र  पर 1993 में एक आतङ्कवादी आक्रमण था। जिसे 26 फरवरी, 1993 को अंजाम दिया गया था, जब एक ट्रक-बम परिसर के उत्तरी टॉवर के नीचे विस्फोट हुआ था।  1,336 एलबी (606 किग्रा) यूरिया नाइट्रेट-हाइड्रोजन गैस वर्धित उपकरण का उद्देश्य उत्तरी टॉवर (टॉवर 1) को दक्षिण टॉवर (टॉवर 2) के ऊपर गिराना था। जिससे दोनों टावर नीचे आ जायें और हजारों लोगों की मौत हो जाये किन्तु यह ऐसा करने में विफल रहे, लेकिन एक गर्भवती महिला सहित छह लोगों की मौत हो गयी और एक हजार से अधिक लोग घायल हो गये। उस दिन इमारत से लगभग 50,000 लोगों को निकाला गया था।
आक्रमण की योजना रमज़ी यूसेफ़, महमूद अबौहलिमा, मोहम्मद सलामेह, निदाल ए. अय्यद, अब्दुल रहमान यासीन और अहमद अजाज सहित आतङ्कवादियों के एक समूह ने बनायी थी। उन्हें यूसुफ़ के चाचा खालिद शेख मोहम्मद से वित्त पोषण प्राप्त हुआ।",,,
