,Domain,Wikipedia Link,Title,Context,Type,Question,Answer
2826,Attacks,https://hi.wikipedia.org/wiki/2016_%E0%A4%A8%E0%A5%80%E0%A4%B8_%E0%A4%B9%E0%A4%AE%E0%A4%B2%E0%A4%BE,2016 नीस हमला,"14 जुलाई 2016, फ्रांस के शहर नीस में बैस्टील (Bastille) दिवस मना रहे लोगों की भीड़ पर हमला किया गया। एक ट्रक जानबूझकर प्रोमेनाड़े देस अंग्लैस (Promenade des Anglais) पर भीड़ में संचालित किया गया इसमें कम से कम 80 लोग मारे गए। अपराधी ने दर्शकों से टकराने से पहले 100 (330 फ़ुट) मीटर तक उच्च गति से ट्रक को चलाया। ट्रक के ड्राइवर को पुलिस द्वारा गोली मार कर मार डाला गया।
हमले से कई घंटों पहले सुबह, फ्रांसीसी राष्ट्रपति फ्रांसुआ ओलांद ने पुष्टि की कि आपातकाल की स्थिति जो नवंबर, 2015 पेरिस हमलों के बाद लगाई गयी थी वो 26 जुलाई 2016 को टूर डी फ्रांस के समापन के बाद खत्म हो जाएगी।[4]
लगभग 22:40 स्थानीय समय नीस के शहर में, एक 25-टन (28-ton) कार्गो ट्रक को प्रोमेंडे देस अंग्लैस पर भीड़ में चलाया गया जो बस्तिल्ले दिवस माना रहे थे। ये लोग आतिशबाजी देखने के लिए जमा हुए थे। ट्रक के रफ़्तार लगभग 32 से 40 किमी/घंटा (20 से 25 मील/घंटा) थी, और इसने लोगों की भीड़ से टकराने से पहले कमसे कम 100 मी॰ (330 फीट) की दूरी तय की थी।[5]
सेबेस्टियन हमबर्ट, जो एल्प्स- मेरीटाइम्स के सब-प्रीफेक्ट हैं ने कहा,"" मौतों की संख्या बहुत अधिक है"", वहां पर गोलीबारी हुई है और ट्रक ड्राईवर मारा गया है।[6] जिसे कुछ मौके पर मौजूद लोगों ने भी बताया है।[7] ट्रक की खोज करने पर पता चला कि यह हथियारों से भरा हुआ था। [8][9][10]
क्रिस्चियन एसट्रोसो, जो प्रोवेंस-एल्प्स- कोटे देजूर (Provence-Alpes-Côte d'Azur) की स्थानीय परिषद् के अध्यक्ष है ने कहा 70 से अधिक लोग मारे गए हैं। [11]
इसके दोषी की पहचान कराने पर यह पता चला कि ये फ्रेंच−तुर्की यानी दोहरी राष्ट्रीयता वाला एक व्यक्ति है जिसकी उम्र 31 वर्ष है। इनकी पहचान इसके ट्रक से प्राप्त हुई।[3]
फ्रांसी के प्रधानमंत्री मैन्युएल वाल्स ने आपात सुरक्षा बैठक के बाद कहा कि फ्रांस के राष्ट्रीय दिवस पर हमले के द्वारा फ्रांस की आत्मा पर हमला किया गया है, उन्होंने यह भी कहा कि फ्रांस स्वयं को अस्थिर नहीं होने देगा और आतंकवादी धमकियों से नहीं डरेगा।[12]
अमेरिका अमेरिकी राष्ट्रपति बराक ओबामा ने कहा, ""फ्रांस के नीस रिजॉर्ट में हुआ हमला ‘भयावह आतंकी हमला’ जान पड़ता है। अमेरिकी जनता की ओर से मैं फ्रांस के नीस में भयावह आतंकी हमला प्रतीत होने वाली उस घटना की कड़ी निंदा करता हूं, जिसमें दर्जनों बेकसूर नागरिक मारे गए और घायल हुए हैं।’’ ओबामा ने कहा कि उन्होंने अपने दल को फ्रांसीसी अधिकारियों के संपर्क में रहने के निर्देश दिए हैं।उन्होंने कहा, ‘‘हमने इस हमले की जांच के लिए और जिम्मेदार लोगों को न्याय के कटघरे में लेकर आने के लिए हर जरूरी मदद की पेशकश दी है। हम इस हमले पर प्रतिक्रिया देने और इससे उबरने के मामले में अपने बेहद पुराने सहयोगी फ्रांस के साथ पूरी एकजुटता और साझेदारी के साथ खड़े हैं।’’
अमेरिकी विदेश मंत्री जॉन केरी ने कहा, ‘‘आज नीस में बेकसूर लोगों पर किया गया हमला एक ऐसे दिन किया गया है, जिस दिन स्वतंत्रता, समानता और भाईचारे का जश्न मनाया जाता है।’’ दिन के समय केरी बासटील डे के जश्न के अवसर पर फ्रांसीसी अधिकारियों के साथ पेरिस में मौजूद थे। उन्होंने कहा, ‘‘अमेरिका संकट की इस घड़ी में फ्रांसीसी लोगों के साथ दृढ़ता से खड़ा रहेगा। हम हर जरूरी मदद उपलब्ध करवाएंगे।’’हमले की निंदा करते हुए अमेरिकी प्रतिनिधि सभा के स्पीकर पॉल रेयान ने कहा, ‘‘हमारी संवेदनाएं एक और आतंकी घटना प्रतीत होने वाले इस हमले के पीड़ितों के साथ हैं। आगामी दिनों में हम यह जानेंगे कि यह किसने किया और क्यों किया। अभी हमें अपने प्रिय मित्र और सहयोगी फ्रांस के साथ दृढ़ता के साथ खड़े रहना चाहिए।’’
सदन की गृह सुरक्षा समिति के अध्यक्ष माइकल मैककॉल ने कहा, ‘‘फ्रांस में हुए आतंकी हमले के जरिए हमने एक बार फिर बुराई का असल चेहरा देखा है।’’ उन्होंने कहा कि ओरलैंडो से लेकर बगदाद तक और बगदाद से नीस तक विश्व भर में हो रहे हमले यह साबित करते हैं कि इस लड़ाई में हम सब एक साथ हैं। हम इन उन्मादियों और इनकी ‘घृणित विचारधारा’ पर जीत हासिल करेंगे। सीनेटर क्रिस मर्फी ने कहा, ‘‘आज का हमला अपनी आजादी का जश्न मना रही फ्रांस की जनता पर किया गया एक भयावह हमला है। यह इस बाद की दुखद ताकीद भी है कि दुनिया में बुराई अपने रास्ते बनाने के लिए प्रयासरत है और इसे रोकने के लिए समन्वित एवं वैश्विक प्रतिक्रिया की जरूरत है।’’सीनेट की खुफिया चयन समिति एवं विदेश संबंधों की समिति के सदस्य सीनेटर मार्को रूबियो ने कहा कि ऐसा प्रतीत होता है कि आतंकवाद ने एक बार फिर यूरोप के दिल पर वार किया है। उन्होंने कहा, ‘‘हम इस भयावह हमले से जुड़ी और अधिक जानकारी का इंतजार कर रहे हैं। फ्रांस के राष्ट्रीय एकता दिवस के मौके पर फ्रांसीसी जनता पर किए गए इस हमले के बाद हम अपने करीबी सहयोगी की जरूरत के समय पर उसके साथ खड़े हैं।’’[13]
भारत भारत के प्रधानमंत्री नरेंद्र मोदी ने ट्वीट कर हमले की कड़े शब्दों में निंदा की, मोदी ने मृतकों के परिजनों के प्रति संवेदना व्यक्त की। उन्होंने कहा दुख की इस घड़ी में हम फ्रांस के साथ हैं।राष्ट्रपति प्रणव मुखर्जी ने भी ट्वीट कर अपनी संवेदना जाहिर कीं। राष्ट्रपति ने कहा कि भारत फ्रांस के लोगों और सरकार के साथ कंधे से कंधा मिलाकर खड़ा है। साथ ही हमले में घायलों के जल्द ठीक होने की कामना भी की।[14]",,,
2827,Attacks,https://hi.wikipedia.org/wiki/%E0%A4%B9%E0%A4%BE%E0%A4%88_%E0%A4%B8%E0%A5%8D%E0%A4%95%E0%A5%82%E0%A4%B2_%E0%A4%95%E0%A5%8B%E0%A4%B2%E0%A4%82%E0%A4%AC%E0%A4%BE%E0%A4%87%E0%A4%A8_%E0%A4%A8%E0%A4%B0%E0%A4%B8%E0%A4%82%E0%A4%B9%E0%A4%BE%E0%A4%B0,हाई स्कूल कोलंबाइन नरसंहार,"हाई स्कूल के नरसंहार पर था कोलंबाइन 20 अप्रैल 1999 में दो छात्रों के कोलंबाइन कोलंबाइन हाई स्कूल में एक स्थान के निकट gemeindefreien डेन्वेर और लिटिलटन, हिंसा है। एरिक हैरिस (18) और Dylan Klebold (17) की हत्या कर दी जबकि बारह वर्ष की आयु 14 से 18 वर्ष के छात्रों, शिक्षक, 24 घायल अधिक लोग मारे गए और फिर खुद को बाहर रखा है कि ऐसा नहीं है दो छात्रों को स्कूल के माध्यम से encirclement पुलिस बलों द्वारा की गई योजनाओं में शूटिंग पर रोक के आसपास के विस्तार और आगे हैं। इस नरसंहार के केंद्रीय पिछलग्गू है ऑस्कर जीतने के एक वृत्तचित्र के लिए बॉलिंग कोलंबाइन द्वारा माइकल मूर .",,,
2828,Attacks,https://hi.wikipedia.org/wiki/2017_%E0%A4%87%E0%A4%B8%E0%A5%8D%E0%A4%A4%E0%A4%BE%E0%A4%A8%E0%A4%AC%E0%A5%81%E0%A4%B2_%E0%A4%A8%E0%A4%BE%E0%A4%88%E0%A4%9F_%E0%A4%95%E0%A5%8D%E0%A4%B2%E0%A4%AC_%E0%A4%B9%E0%A4%AE%E0%A4%B2%E0%A4%BE,2017 इस्तानबुल नाईट क्लब हमला,"1 जनवरी 2017 को इस्तानबुल, तुर्की में एक मास शूटिंग हुई जिसमें लगभग 35 लोग मारे गए। तुर्की के शहर इस्तानबुल में एक प्रसिद्ध नाइट क्लब में नए साल की पार्टी के दौरान एक बंदूकधारी ने हमला कर दिया। शहर के गवर्नर वासिप साहिन के अनुसार हमलावर ने नाइट क्लब में घुसने से पहले बाहर एक पुलिसकर्मी और एक नागरिक की हत्या कर दी।जिस वक्त हमला हुआ, नाइट क्लब में करीब 700 लोग मौजूद थे।[1] हमले में दो भारतीय के मरने की सूचना भारत की विदेश मंत्री सुषमा स्वराज ने ट्वीट कर दी।[2][3]
हमला 1 जनवरी 2017 को स्थानीय समयानुसार देर रात 1.30 बजे (यूटीसी+3) के आसपास ओर्ताकोय इलाके के रीना नाइट क्लब में हुआ। इसमें 40 अन्य घायल हो गए।'सीएनएन तुर्क' की रिपोर्ट के अनुसार, हमलावर ने सांता क्लॉज की ड्रेस पहन रखी थी।[1]
हमले में भारत के दो नागरिक मारे गए, भारत की विदेश मंत्री सुषमा स्वराज ने ट्वीटर पर इसकी जानकारी दी। मरने वालों में एक महिला है खुशी शाह जो गुजरात से है और दूसरा व्यक्ति पूर्व राज्य सभा सांसद का पुत्र अबीस रिज़वी है।[3]
<",,,
2829,Attacks,https://hi.wikipedia.org/wiki/2017_%E0%A4%B8%E0%A5%87%E0%A4%82%E0%A4%9F_%E0%A4%AA%E0%A5%80%E0%A4%9F%E0%A4%B0%E0%A5%8D%E0%A4%B8%E0%A4%AC%E0%A4%B0%E0%A5%8D%E0%A4%97_%E0%A4%AE%E0%A5%87%E0%A4%9F%E0%A5%8D%E0%A4%B0%E0%A5%8B_%E0%A4%AE%E0%A5%87%E0%A4%82_%E0%A4%B9%E0%A4%AE%E0%A4%B2%E0%A4%BE,2017 सेंट पीटर्सबर्ग मेट्रो में हमला,"सेंट पीटर्सबर्ग मेट्रो में धमाका 3 अप्रैल 2017 को सेंट पीटर्सबर्ग स्टेशन में हुआ। सेनाया प्लोसचाड और टेक्नोलोजीचेस्की स्टेशन के मध्य धमाका किया गया था, जिसमें आधिकारिक रूप से 9 लोगों की मौत हो गई। इस धमाके से लगभग 50 लोग घायल हो गए। इन घायलों में 2 लोगों की बाद में मौत हो गई। विस्फोटक उपकरण को एक बैग में रखा गया था। इसी के साथ एक अन्य मेट्रो स्टेशन में भी एक विस्फोटक उपकरण मिला था, जिसे निसक्रिय भी कर दिया गया।[1]
3 अप्रैल 2017 को सेंट पीटर्सबर्ग में 14:40 बजे ट्रेन में अचानक धमाका हुआ। इस दौरान ट्रेन मेट्रो टेक्नोलोजीचेस्की और सेनाया प्लोसचाड स्टेशन  के मध्य था।[2]
विस्फोट के बारे में पता चलने के बाद उसके आसपास के सभी स्टेशनों को बंद कर दिया गया। इसमें नेवस्की प्रोस्पेक्ट, मायकोव्स्कावा, प्लोसचाड वोस्स्तनिया आदि हैं।[3] अन्य स्टेशनों को भी बंद कर दिया गया।[4][5] राज्यपाल जॉर्जी पोल्तव्चेंकों ने आपातकाल की स्थिति को संभालते हुए यह आदेश दिया था।[6]
एनटीवी  के अनुसार, विस्फोट में 9 लोगों की मौत हो गई और 20 से अधिक घायल हो गए।[7] बाद में मिली सूचना के अनुसार घायलों की संख्या 45 से अधिक हो गई। घायलों में से दो लोगों की बाद में मौत हो गई। इस कारण मरने वालों की संख्या भी 9 से बढ़ कर 11 हो गई।
इस बीच, रूस की जाँच कमेटी की मेट्रो के ड्राइवर की तारीफ़ की है. जाँच अधिकारियों का कहना है कि ड्राइवर ने मेट्रो न रोककर सही फ़ैसला लिया और स्टेशन आने पर ही ट्रेन रोकी. संघीय जाँच प्राधिकरण ने अपने बयान में कहा कि ड्राइवर के इस फ़ैसले से कुछ और लोग भी हादसे का शिकार होने से बचे तथा घायलों को निकालने में भी मदद मिली.[8]
—व्लादिमीर पुतिन, बेलारूस के राष्ट्रपति के साथ बैठक के दौरान",,,
2830,Attacks,https://hi.wikipedia.org/wiki/2017_%E0%A4%85%E0%A4%B2%E0%A4%AA%E0%A5%8D%E0%A4%AA%E0%A5%8B_%E0%A4%86%E0%A4%A4%E0%A5%8D%E0%A4%AE%E0%A4%98%E0%A4%BE%E0%A4%A4%E0%A5%80_%E0%A4%95%E0%A4%BE%E0%A4%B0_%E0%A4%B9%E0%A4%AE%E0%A4%B2%E0%A4%BE,2017 अलप्पो आत्मघाती कार हमला,यह हमला 16 अप्रैल 2017 को एक कार बम द्वारा बस पर किया गया था। इस बम धमाके में 126 लोग मारे गए थे जिसमें 68 बच्चे भी शामिल थे। हमला उस समय किया गया था जब इदलिब प्रांत के शिया बहुल अल-फोआ और किफ्राया गाँवो में फँसे लगभग पाँच हजार लोगों को बसों के द्वारा सरकार नियंत्रित अलप्पो क्षेत्र में लाया जा रहा था। इनमें सैकड़ों की संख्या में सरकार समर्थित लड़ाके भी थे। [2] घटना स्थल पर बस के परखच्चे उड़ गए थे और उसमें सभी सवार लोग मारे गए थे। इस हमले की पोप ने निंदा की थी। लेकिन अभी तक किसी भी आंतकी संगठन ने इस हमले की जिम्मेदारी स्वीकार नहीं की है।,,,
